{
  "schema_version": "1.0.0",
  "design_id": "design_iteration_02",
  "parent_design_id": "design_iteration_01",
  "source_case": "bridge",
  "source_model": {
    "path": "public/cases/bridge/model.json",
    "commit": "b6eeff872ccd62ddab8563cd2de6dcaf3a749340"
  },
  "mechanics_backend": {
    "id": "original-bridge-hybrid",
    "generator": "cases/bridge/model.mjs",
    "solver": "public/cases/bridge/solver.mjs"
  },
  "input": {
    "kind": "research_prompt_with_existing_model",
    "prompt": "Reduce maximum deck displacement relative to baseline by changing only primary structural section scale.",
    "image_reference": "public/cases/bridge/original-concept.png",
    "image_to_geometry_performed": false
  },
  "objective": {
    "description": "Reduce maximum deck displacement relative to baseline",
    "metric": "maxDeckDisplacement",
    "relation": "iteration < baseline"
  },
  "constraints": {
    "mutable_parameters": [
      "primaryScale"
    ],
    "invariants": [
      "nodes",
      "topology",
      "supports",
      "loads",
      "materials",
      "secondaryScale",
      "cablePrestress",
      "cable rest lengths",
      "solver equations and tolerances"
    ]
  },
  "baseline_parameters": {
    "loadCase": "uniform",
    "pressure": 5,
    "pointLoad": 500,
    "E": 200,
    "primaryScale": 1,
    "secondaryScale": 1,
    "selectedNode": 13,
    "nodeLoad": 0,
    "cablePrestress": 80
  },
  "parameter_overrides": {
    "primaryScale": 1.5
  },
  "provenance": {
    "source_repository": "https://github.com/wlululu/cephalo-silk-structural-lab",
    "source_commit": "b6eeff872ccd62ddab8563cd2de6dcaf3a749340",
    "pipeline_repository": "https://github.com/wlululu/cephalo-silk-design-pipeline",
    "pipeline_starting_commit": "f6c3b73059246a36e167e98f12ef1b393ed893ab",
    "execution_head": "cd74e077d61cfcba91f8c53dbe8e6eeb4120285a",
    "working_tree_status": "M README.md\n M closed_loop_bridge/trajectory/baseline_verification.json\n D closed_loop_bridge/trajectory/design_iteration_02.json\n M closed_loop_bridge/trajectory/feedback_for_iteration_02.json\n M closed_loop_bridge/trajectory/iteration_01_verification.json\n D closed_loop_bridge/trajectory/iteration_02_response.json\n D closed_loop_bridge/trajectory/preservation_verification.json\n D closed_loop_bridge/trajectory_comparison.json\n D closed_loop_bridge/trajectory_summary.md\n M main.tsx\n M package.json\n M pipeline/README.md\n M pipeline/bridge-backend.mjs\n M shared/Platform.tsx\n?? pipeline-ui/\n?? shared/SurfaceNavigation.tsx\n?? shared/surface-navigation.css\n?? tests/pipeline-preservation.mjs\n?? tests/pipeline-ui.mjs",
    "timestamp": "2026-09-23T23:37:23.380Z",
    "execution_command": "npm run closed-loop:bridge",
    "node": "v24.21.0",
    "platform": "darwin",
    "architecture": "arm64",
    "generator_version": "3.0.0",
    "architecture_starting_commit": "22fb33f4078dc56c920ee9296c442617749374b5",
    "source_sha256": {
      "public/cases/bridge/model.json": "c78af1ec0f341c2ddb7b06fbfed8219272eaed7543ede6651c2bd36c363d91b2",
      "cases/bridge/model.mjs": "0d5e1406d6cabaf031105d5ec42ecb46b48f136fb0ea91f8f588b1cf524574a9",
      "public/cases/bridge/solver.mjs": "2da01b8bfd510b1b0a972a4f89a3a0d9569930bfdd6fd90d993ee04659a0cce0",
      "public/cases/bridge/hybrid.mjs": "1c7132f610edfb49a985a6011ccffcf3723bab353e9e6298f0e02c3ee734f4b1",
      "public/cases/bridge/frame-element.mjs": "f18b410cc715ee3570e192b2c592492ecfc32cab2345fc5ba771af6959e51cc4"
    },
    "pipeline_sha256": {
      "pipeline/bridge-backend.mjs": "33a7d0d6969456201cc7fba1305d0c198d884888d39988055bbad4c16378955c",
      "pipeline/bridge-trajectory.mjs": "ba9d9f74d3e5f8e9404a9311d0b67aaede043304de7ae64458fd4a6a0faf37f3",
      "pipeline/iteration-controller.mjs": "b70063f21de6aab9765eb81d01c8bcc49c72d1e43d5ca606203f236b0d915219",
      "pipeline/objective-adapter.mjs": "3ede8b23314cc6ef8b4b8933d556cfd23b9281cbfb092eca5d92ce93360bc496",
      "pipeline/adapter-registry.mjs": "7892c984d4caef9e02db92a2374a038bc27b054fe3fc6ed40e6c7e2ea18fb4ca",
      "pipeline/bridge-adapters.mjs": "df6c41d856c402c3def054601677f0bcee0fad009545c64eab011229f0b34fb8",
      "pipeline/diagnostics.mjs": "3dd8035b29b81ef8da44e98a4aa30b8b9efbff0970b222534290d65ddb11a260",
      "pipeline/designspec.schema.json": "ea301c8cda0575ec9dbc9c7d9e81aa367f42bc6e53f36fd5922ad10625742733",
      "scripts/run_closed_loop_bridge.mjs": "21ba8a41b45355d70eea7f80be2ab0173b9f2654877aef7f2383a9e8b0e0c592",
      "closed_loop_bridge/iteration_policy.json": "613f226149a0ecb1627b859fb6b59c46a6813d3c6e7a6235016534a17b0862db"
    }
  },
  "revision": {
    "revision_step": 2,
    "previous_primaryScale": 1.25,
    "step_size": 0.25,
    "original_baseline_primaryScale": 1,
    "illustrative_target_reduction_percent": 20,
    "policy_reference": "closed_loop_bridge/iteration_policy.json",
    "policy_sha256": "613f226149a0ecb1627b859fb6b59c46a6813d3c6e7a6235016534a17b0862db",
    "feedback_reference": "closed_loop_bridge/trajectory/feedback_for_iteration_02.json",
    "feedback_sha256": "ced03184b8cfc81a6b2b71ce2bdca3f34b08a3db79863b3e454ad6b32097e006",
    "unchanged_parameters": {
      "loadCase": "uniform",
      "pressure": 5,
      "pointLoad": 500,
      "E": 200,
      "secondaryScale": 1,
      "selectedNode": 13,
      "nodeLoad": 0,
      "cablePrestress": 80
    }
  }
}
